{
  "schema_version": "1.0",
  "paper": {
    "id": "einstein-1905-inertia-energy",
    "title": {
      "en": "Does the Inertia of a Body Depend upon its Energy-Content?",
      "zh": "物体的惯性是否取决于它所含的能量？"
    },
    "authors": [
      "Albert Einstein"
    ],
    "year": 1905,
    "citation": "Annalen der Physik 18 (4th series), 639–641 · Received 27 Sep 1905",
    "doi": "10.1002/andp.19053231314",
    "source_url": "https://www.fourmilab.ch/etexts/einstein/E_mc2/www/",
    "original_url": "https://zenodo.org/records/1424057/files/article.pdf?download=1",
    "rights": {
      "en": "Fourmilab expressly states that the 1923 source translation and its electronic transcription are in the public domain and may be reproduced in any manner or medium. This dataset reproduces that public-domain English text. The Chinese translation and claim segmentation were prepared by AI for this example. The modern publisher website design and third-party scan hosting metadata are not reproduced as part of the paper.",
      "zh": "Fourmilab 明示：1923 年来源译本及其电子转录均属公版，可通过任何方式和媒介复制。本数据使用该公版英文本。中文译文与观点划分由 AI 为本例制作。现代出版商网页设计和扫描托管页元数据不属于所复现的论文正文。"
    },
    "edition": {
      "zh": "采用 W. Perrett / G. B. Jeffery 1923 年英译、John Walker 于 2001 年制作的 Fourmilab 电子版，收录该版论文全部正文及脚注。\n英译本以 c 表示光速；德文原刊以 V 表示光速。物理含义一致。\n英文正文保留历史排法“L/9 × 10²⁰”。根据 L/c²，其分母应读作 9 × 10²⁰（约 3 × 10¹⁰ cm/s 的平方）；中文显式加括号以消除歧义。\n论文正文没有单独写出今天常用的 E = mc²；正文给出质量变化关系，并以文字提出更广泛的结论。\n原刊脚注1为前文书目；英译以链接承接。原刊署“伯尔尼，1905年9月”，9月27日为收稿日期。",
      "en": "Complete paper body and its footnote, using the W. Perrett / G. B. Jeffery English translation (1923), as transcribed by John Walker for Fourmilab (2001).\nThe English edition uses c for the speed of light; the original German paper uses V. The physical meaning is unchanged.\nThe historical notation “L/9 × 10²⁰” is preserved in the English reading text. Its intended denominator is 9 × 10²⁰ (the square of approximately 3 × 10¹⁰ cm/s), not 9 followed by multiplication outside the denominator. The Chinese text makes these parentheses explicit.\nThe familiar standalone equation E = mc² does not occur verbatim in this paper body. The paper states a change-of-mass relation and a broader verbal conclusion.\nOriginal footnote 1 supplies the earlier-paper reference, represented by a link in the English edition. The original is dated Bern, September 1905; September 27 is the receipt date."
    },
    "scope": {
      "en": "From “The results of the previous investigation” through “the emitting and absorbing bodies”, plus the single asterisk footnote. Includes all six displayed equation groups. Excludes Fourmilab’s “About this Edition/Document” editorial text and navigation.",
      "zh": "从“The results of the previous investigation”至“the emitting and absorbing bodies”的全部正文，另含一条星号脚注；保留全部六组行间公式。Fourmilab 的“About this Edition/Document”编辑说明和导航不计入论文正文。"
    },
    "audited_at": "2026-09-12",
    "sections": [
      {
        "id": "principles",
        "label": {
          "zh": "前提与光能变换",
          "en": "Principles & light energy"
        },
        "paragraph_id": "p01"
      },
      {
        "id": "experiment",
        "label": {
          "zh": "双向发光思想实验",
          "en": "Symmetric emission"
        },
        "paragraph_id": "p08"
      },
      {
        "id": "kinetics",
        "label": {
          "zh": "动能与质量变化",
          "en": "Kinetic energy & mass"
        },
        "paragraph_id": "p13"
      },
      {
        "id": "conclusion",
        "label": {
          "zh": "结论与实验建议",
          "en": "Conclusions & proposal"
        },
        "paragraph_id": "p20"
      },
      {
        "id": "notes",
        "label": {
          "zh": "脚注",
          "en": "Footnote"
        },
        "paragraph_id": "p25"
      }
    ]
  },
  "paragraphs": [
    {
      "id": "p01",
      "type": "body",
      "locator": "Original p. 639",
      "segments": [
        {
          "id": "s001",
          "en": "The results of the previous investigation lead to a very interesting conclusion, which is here to be deduced.",
          "zh": "此前研究的结果导向一个很有意思的结论，下面就来推导这一结论。",
          "kind": "claim",
          "claim_ids": [
            "c01"
          ]
        }
      ]
    },
    {
      "id": "p02",
      "type": "body",
      "locator": "Original p. 639",
      "segments": [
        {
          "id": "s002",
          "en": "I based that investigation on the Maxwell-Hertz equations for empty space,",
          "zh": "那项研究以真空中的麦克斯韦—赫兹方程为基础，",
          "kind": "claim",
          "claim_ids": [
            "c02"
          ]
        },
        {
          "id": "s003",
          "en": "together with the Maxwellian expression for the electromagnetic energy of space,",
          "zh": "同时采用麦克斯韦关于空间中电磁能量的表达式，",
          "kind": "claim",
          "claim_ids": [
            "c03"
          ]
        },
        {
          "id": "s004",
          "en": "and in addition the principle that:—",
          "zh": "并且采用如下原理：",
          "kind": "context",
          "claim_ids": [],
          "exclusion_reason": {
            "zh": "符号说明或衔接语句；全文保留，不作为独立论证观点。",
            "en": "Notation or connective prose, retained in full rather than treated as an independent argumentative claim."
          }
        }
      ]
    },
    {
      "id": "p03",
      "type": "body",
      "locator": "Original p. 639",
      "segments": [
        {
          "id": "s005",
          "en": "The laws by which the states of physical systems alter are independent of the alternative, to which of two systems of coordinates, in uniform motion of parallel translation relatively to each other, these alterations of state are referred (principle of relativity).",
          "zh": "对于两个彼此作匀速平移的坐标系，无论把物理系统的状态变化归于哪一个坐标系来描述，支配这种变化的定律都相同（相对性原理）。",
          "kind": "claim",
          "claim_ids": [
            "c04"
          ]
        }
      ]
    },
    {
      "id": "p04",
      "type": "body",
      "locator": "Original p. 639",
      "segments": [
        {
          "id": "s006",
          "en": "With these principles* as my basis I deduced inter alia the following result (§ 8):—",
          "zh": "以这些原理*为基础，我曾推导出若干结果，其中包括以下结果（第 8 节）：",
          "kind": "claim",
          "claim_ids": [
            "c05"
          ]
        }
      ]
    },
    {
      "id": "p05",
      "type": "body",
      "locator": "Original p. 639",
      "segments": [
        {
          "id": "s007",
          "en": "Let a system of plane waves of light, referred to the system of co-ordinates (x, y, z), possess the energy l; let the direction of the ray (the wave-normal) make an angle φ with the axis of x of the system.",
          "zh": "设一组平面光波相对于坐标系 (x, y, z) 的能量为 l；光线方向（波面法线）与该坐标系的 x 轴夹角为 φ。",
          "kind": "claim",
          "claim_ids": [
            "c06"
          ]
        },
        {
          "id": "s008",
          "en": "If we introduce a new system of co-ordinates (ξ, η, ζ) moving in uniform parallel translation with respect to the system (x, y, z), and having its origin of co-ordinates in motion along the axis of x with the velocity v,",
          "zh": "若引入一个相对于 (x, y, z) 作匀速平移的新坐标系 (ξ, η, ζ)，其坐标原点以速度 v 沿 x 轴运动，",
          "kind": "claim",
          "claim_ids": [
            "c07"
          ]
        },
        {
          "id": "s009",
          "en": "then this quantity of light—measured in the system (ξ, η, ζ)—possesses the energy",
          "zh": "则这束光在 (ξ, η, ζ) 系中测得的能量为",
          "kind": "context",
          "claim_ids": [
            "c08"
          ]
        }
      ]
    },
    {
      "id": "p06",
      "type": "equation",
      "locator": "Original p. 639",
      "segments": [
        {
          "id": "s010",
          "en": "l* = l(1 − (v/c) cos φ)/√(1 − v²/c²)",
          "zh": "l* = l(1 − (v/c) cos φ)/√(1 − v²/c²)",
          "kind": "equation",
          "claim_ids": [
            "c08"
          ],
          "latex": "l^* = l \\frac{1-\\frac{v}{c}\\cos\\phi}{\\sqrt{1-v^2/c^2}}"
        }
      ]
    },
    {
      "id": "p07",
      "type": "body",
      "locator": "Original p. 639",
      "segments": [
        {
          "id": "s011",
          "en": "where c denotes the velocity of light. We shall make use of this result in what follows.",
          "zh": "其中 c 表示光速。下文将使用这一结果。",
          "kind": "context",
          "claim_ids": [],
          "exclusion_reason": {
            "zh": "符号说明或衔接语句；全文保留，不作为独立论证观点。",
            "en": "Notation or connective prose, retained in full rather than treated as an independent argumentative claim."
          }
        }
      ]
    },
    {
      "id": "p08",
      "type": "body",
      "locator": "Original p. 640",
      "segments": [
        {
          "id": "s012",
          "en": "Let there be a stationary body in the system (x, y, z), and let its energy—referred to the system (x, y, z) be E₀.",
          "zh": "设有一个在 (x, y, z) 系中静止的物体，其相对于 (x, y, z) 系的能量为 E₀。",
          "kind": "claim",
          "claim_ids": [
            "c09"
          ]
        },
        {
          "id": "s013",
          "en": "Let the energy of the body relative to the system (ξ, η, ζ) moving as above with the velocity v, be H₀.",
          "zh": "令该物体相对于上述以速度 v 运动的 (ξ, η, ζ) 系的能量为 H₀。",
          "kind": "claim",
          "claim_ids": [
            "c09"
          ]
        }
      ]
    },
    {
      "id": "p09",
      "type": "body",
      "locator": "Original p. 640",
      "segments": [
        {
          "id": "s014",
          "en": "Let this body send out, in a direction making an angle φ with the axis of x, plane waves of light, of energy ½L measured relatively to (x, y, z), and simultaneously an equal quantity of light in the opposite direction.",
          "zh": "令该物体沿与 x 轴夹角为 φ 的方向发出平面光波，其相对于 (x, y, z) 系测得的能量为 ½L，同时沿相反方向发出等量的光。",
          "kind": "claim",
          "claim_ids": [
            "c10"
          ]
        },
        {
          "id": "s015",